{
  "研究范围": "半导体设备国产替代",
  "生成依据": {
    "材料数量": 1,
    "独立来源数量": 1,
    "历史样本数量": 0,
    "是否多来源": false,
    "是否包含历史样本": false,
    "来源覆盖": [
      {
        "来源类型": "研报",
        "材料数量": 1,
        "代表材料": ["某半导体设备公司财报点评"]
      }
    ],
    "历史依据说明": "样例仅展示框架形态，尚未接入多来源研报、公告、财报和历史案例。",
    "单来源逻辑处理方式": "全部标记为单来源候选或需补历史样本，不能作为相对可信模板。",
    "证据材料": ["某半导体设备公司财报点评"]
  },
  "研究对象骨架": [
    { "名称": "半导体设备", "对象类型": "Industry", "角色": "研究范围", "候选状态": "可保留候选" },
    { "名称": "刻蚀设备", "对象类型": "Segment", "角色": "细分环节", "候选状态": "需补来源" },
    { "名称": "设备公司", "对象类型": "Company", "角色": "变量挂载对象", "候选状态": "可保留候选" },
    { "名称": "晶圆厂客户", "对象类型": "Segment", "角色": "需求侧和验证侧", "候选状态": "需专家校准" }
  ],
  "核心状态变量": [
    {
      "变量名称": "客户验证进度",
      "观测口径": "进入测试、完成验证、导入产线、批量采购等阶段标签",
      "适用范围": "国产半导体设备导入晶圆厂客户流程",
      "历史依据": "未提供历史样本，需补充不同设备环节客户验证到订单转化的历史案例。",
      "证据材料": ["某半导体设备公司财报点评"],
      "候选状态": "需补历史样本"
    },
    {
      "变量名称": "新签订单",
      "观测口径": "指定期间新签订单金额、同比、环比或客户结构变化",
      "适用范围": "设备公司订单变化",
      "历史依据": "样例材料提供单期订单观测，尚缺多期历史验证。",
      "证据材料": ["某半导体设备公司财报点评"],
      "候选状态": "单来源候选"
    }
  ],
  "常见研究触发": [
    {
      "触发名称": "财报订单变化",
      "触发类型": "状态变化",
      "承接方式": "形成订单变量观测或订单能见度 Signal 候选",
      "证据材料": ["某半导体设备公司财报点评"]
    }
  ],
  "关键传导逻辑": [
    {
      "来源变量": "新签订单",
      "目标变量": "收入确认节奏",
      "方向映射": "新签订单增长，未来收入确认概率提升",
      "滞后窗口": "未来 2-3 个季度",
      "边界条件": "交付延期或毛利率低于历史均值时传导减弱",
      "历史依据": "尚未补充历史订单高增后的收入确认兑现样本。",
      "证据材料": ["某半导体设备公司财报点评"],
      "候选状态": "单来源候选"
    }
  ],
  "验证信号": [
    {
      "信号名称": "合同负债变化",
      "signalRole": "tracking",
      "观察对象": "合同负债",
      "数据来源": "后续财报",
      "观察窗口": "未来 1-3 个季度",
      "预期方向": "维持或增加",
      "关联变量": "订单能见度"
    }
  ],
  "阻断条件": [
    {
      "条件描述": "交付延期",
      "作用对象": "订单到收入确认的状态假设",
      "signalRole": "blocking",
      "可观察改写": "订单交付或验收未在预期窗口完成",
      "阈值或窗口": "未来 2-3 个季度",
      "候选状态": "候选"
    }
  ],
  "模板影响记录": [
    {
      "材料标题": "某半导体设备公司财报点评",
      "影响类型": "强化",
      "影响对象": "订单到收入确认传导逻辑",
      "沉淀建议": "需补来源"
    }
  ],
  "待补材料": ["行业深度研报", "公司公告", "政策原文", "晶圆厂扩产资料"],
  "待专家校准问题": ["国产替代进程的代理指标应采用哪些口径", "不同设备环节的变量是否需要拆分"],
  "可沉淀候选资产": ["客户验证进度", "订单能见度", "订单到收入确认传导逻辑"],
  "质量边界": [
    "当前样例材料数量不足，不能产出相对可信历史支持模板。",
    "订单到收入确认传导仍需多来源材料和历史兑现样本验证。"
  ]
}
